{
  "key": "pci-saq-c-vt",
  "name": "PCI DSS v4.0.1 SAQ C-VT",
  "short_name": "SAQ C-VT",
  "publisher": "PCI SSC",
  "last_updated": "2026-06-27",
  "description": "Self-Assessment Questionnaire C-VT subset of PCI DSS v4.0.1 (79 requirements).",
  "category": "saq",
  "imports": [
    {
      "catalog": "pci-dss-4-0-1",
      "include_controls": [
        "1.3",
        "1.3.1",
        "1.3.2",
        "1.3.3",
        "1.5",
        "1.5.1",
        "2.1",
        "2.1.1",
        "2.2",
        "2.2.2",
        "2.2.4",
        "2.2.5",
        "2.2.6",
        "2.2.7",
        "2.3",
        "2.3.1",
        "2.3.2",
        "3.1",
        "3.1.1",
        "3.3",
        "3.3.1",
        "3.3.1.2",
        "3.4",
        "3.4.1",
        "4.2",
        "4.2.1.2",
        "5.2",
        "5.2.1",
        "5.2.2",
        "5.3",
        "5.3.1",
        "5.3.2",
        "5.3.3",
        "5.3.4",
        "5.3.5",
        "5.4",
        "5.4.1",
        "6.3",
        "6.3.1",
        "6.3.3",
        "7.2",
        "7.2.2",
        "8.1",
        "8.1.1",
        "8.2",
        "8.2.1",
        "8.2.2",
        "8.2.4",
        "8.2.5",
        "8.3",
        "8.3.1",
        "8.3.6",
        "8.4",
        "8.4.1",
        "9.1",
        "9.1.1",
        "9.2",
        "9.2.1",
        "9.4",
        "9.4.1",
        "9.4.1.1",
        "9.4.2",
        "9.4.3",
        "9.4.4",
        "9.4.6",
        "12.1",
        "12.1.1",
        "12.1.2",
        "12.6",
        "12.6.1",
        "12.6.3.1",
        "12.8",
        "12.8.1",
        "12.8.2",
        "12.8.3",
        "12.8.4",
        "12.8.5",
        "12.10",
        "12.10.1"
      ]
    }
  ]
}
