{
  "key": "pci-saq-c",
  "name": "PCI DSS v4.0.1 SAQ C",
  "short_name": "SAQ C",
  "publisher": "PCI SSC",
  "last_updated": "2026-06-27",
  "description": "Self-Assessment Questionnaire C subset of PCI DSS v4.0.1 (163 requirements).",
  "category": "saq",
  "imports": [
    {
      "catalog": "pci-dss-4-0-1",
      "include_controls": [
        "1.3",
        "1.3.1",
        "1.3.2",
        "1.3.3",
        "2.1",
        "2.1.1",
        "2.2",
        "2.2.1",
        "2.2.2",
        "2.2.3",
        "2.2.4",
        "2.2.5",
        "2.2.6",
        "2.2.7",
        "2.3",
        "2.3.1",
        "2.3.2",
        "3.1",
        "3.1.1",
        "3.3",
        "3.3.1",
        "3.3.1.2",
        "3.3.1.3",
        "3.4",
        "3.4.1",
        "4.2",
        "4.2.1",
        "4.2.1.2",
        "4.2.2",
        "5.1",
        "5.1.1",
        "5.2",
        "5.2.1",
        "5.2.2",
        "5.2.3",
        "5.2.3.1",
        "5.3",
        "5.3.1",
        "5.3.2",
        "5.3.2.1",
        "5.3.3",
        "5.3.4",
        "5.3.5",
        "5.4",
        "5.4.1",
        "6.2",
        "6.2.1",
        "6.2.2",
        "6.2.3.1",
        "6.2.4",
        "6.3",
        "6.3.1",
        "6.3.3",
        "6.5.1",
        "6.5.2",
        "7.2",
        "7.2.2",
        "7.2.3",
        "7.2.4",
        "7.2.5",
        "8.1",
        "8.1.1",
        "8.2",
        "8.2.1",
        "8.2.2",
        "8.2.4",
        "8.2.5",
        "8.2.6",
        "8.2.7",
        "8.2.8",
        "8.3",
        "8.3.1",
        "8.3.2",
        "8.3.3",
        "8.3.4",
        "8.3.5",
        "8.3.6",
        "8.3.7",
        "8.3.8",
        "8.3.9",
        "8.4.1",
        "8.4.2",
        "8.4.3",
        "8.5",
        "8.5.1",
        "8.6",
        "8.6.1",
        "8.6.2",
        "8.6.3",
        "9.1",
        "9.1.1",
        "9.2",
        "9.2.1",
        "9.2.1.1",
        "9.2.2",
        "9.4",
        "9.4.1",
        "9.4.1.1",
        "9.4.2",
        "9.4.3",
        "9.4.4",
        "9.4.6",
        "9.5",
        "9.5.1",
        "9.5.1.1",
        "9.5.1.2",
        "9.5.1.3",
        "10.1",
        "10.1.1",
        "10.2",
        "10.2.1.2",
        "10.2.1.4",
        "10.2.1.5",
        "10.2.2",
        "10.3",
        "10.3.1",
        "10.3.2",
        "10.3.4",
        "10.4.1",
        "10.4.1.1",
        "10.4.2",
        "10.4.2.1",
        "10.4.3",
        "10.5",
        "10.5.1",
        "10.6",
        "10.6.1",
        "10.6.2",
        "10.6.3",
        "11.2",
        "11.2.1",
        "11.2.2",
        "11.3",
        "11.3.1",
        "11.3.1.3",
        "11.3.2",
        "11.3.2.1",
        "11.4",
        "11.4.5",
        "11.5",
        "11.5.2",
        "12.1",
        "12.1.1",
        "12.1.2",
        "12.1.3",
        "12.2",
        "12.2.1",
        "12.3",
        "12.3.1",
        "12.6",
        "12.6.1",
        "12.6.3.1",
        "12.8",
        "12.8.1",
        "12.8.2",
        "12.8.3",
        "12.8.4",
        "12.8.5",
        "12.10",
        "12.10.1",
        "12.10.3",
        "A2.1",
        "A2.1.1"
      ]
    }
  ]
}
