{
  "key": "csa-ccm-4-1-lite",
  "name": "CSA CCM v4.1 Lite",
  "short_name": "CCM Lite",
  "publisher": "CSA",
  "last_updated": "2026-06-27",
  "description": "The \"CCM Lite\" subset of CSA Cloud Controls Matrix v4.1 (96 controls).",
  "category": "subset",
  "imports": [
    {
      "catalog": "csa-ccm-4-1",
      "include_controls": [
        "A&A-02",
        "A&A-03",
        "A&A-04",
        "A&A-06",
        "AIS-02",
        "AIS-04",
        "AIS-06",
        "AIS-07",
        "AIS-08",
        "BCR-01",
        "BCR-02",
        "BCR-03",
        "BCR-08",
        "BCR-09",
        "CCC-01",
        "CCC-02",
        "CCC-04",
        "CCC-05",
        "CCC-06",
        "CCC-07",
        "CCC-09",
        "CEK-01",
        "CEK-02",
        "CEK-03",
        "CEK-04",
        "CEK-05",
        "CEK-10",
        "CEK-12",
        "CEK-13",
        "CEK-14",
        "DCS-04",
        "DCS-06",
        "DCS-07",
        "DSP-01",
        "DSP-03",
        "DSP-04",
        "DSP-05",
        "DSP-06",
        "DSP-07",
        "DSP-08",
        "DSP-10",
        "DSP-11",
        "DSP-12",
        "DSP-13",
        "DSP-14",
        "DSP-16",
        "DSP-17",
        "DSP-19",
        "GRC-01",
        "GRC-02",
        "GRC-06",
        "GRC-07",
        "HRS-03",
        "HRS-04",
        "HRS-11",
        "I&S-03",
        "I&S-04",
        "I&S-06",
        "I&S-07",
        "I&S-09",
        "IAM-01",
        "IAM-03",
        "IAM-04",
        "IAM-05",
        "IAM-06",
        "IAM-07",
        "IAM-08",
        "IAM-09",
        "IAM-10",
        "IAM-13",
        "IPY-01",
        "LOG-01",
        "LOG-04",
        "LOG-05",
        "LOG-08",
        "SEF-03",
        "SEF-04",
        "SEF-07",
        "SEF-08",
        "STA-01",
        "STA-03",
        "STA-05",
        "STA-08",
        "TVM-02",
        "TVM-03",
        "TVM-05",
        "TVM-08",
        "TVM-10",
        "TVM-11",
        "UEM-02",
        "UEM-04",
        "UEM-05",
        "UEM-06",
        "UEM-09",
        "UEM-10",
        "UEM-13"
      ]
    }
  ]
}
