{
  "key": "pci-saq-b",
  "name": "PCI DSS v4.0.1 SAQ B",
  "short_name": "SAQ B",
  "publisher": "PCI SSC",
  "last_updated": "2026-06-27",
  "description": "Self-Assessment Questionnaire B subset of PCI DSS v4.0.1 (38 requirements).",
  "category": "saq",
  "imports": [
    {
      "catalog": "pci-dss-4-0-1",
      "include_controls": [
        "3.1",
        "3.1.1",
        "3.3",
        "3.3.1",
        "3.3.1.1",
        "3.3.1.2",
        "3.3.1.3",
        "3.4",
        "3.4.1",
        "7.2",
        "7.2.2",
        "9.4",
        "9.4.1",
        "9.4.1.1",
        "9.4.2",
        "9.4.3",
        "9.4.4",
        "9.4.6",
        "9.5",
        "9.5.1",
        "9.5.1.1",
        "9.5.1.2",
        "9.5.1.2.1",
        "9.5.1.3",
        "12.1",
        "12.1.1",
        "12.1.2",
        "12.1.3",
        "12.6",
        "12.6.1",
        "12.8",
        "12.8.1",
        "12.8.2",
        "12.8.3",
        "12.8.4",
        "12.8.5",
        "12.10",
        "12.10.1"
      ]
    }
  ]
}
